{
  "schemaVersion": 1,
  "id": "bassline-starter-02",
  "family": "bassline",
  "name": "Sparse stabs",
  "source": { "kind": "hand-authored", "reference": null, "confidence": "placeholder" },
  "tempo": { "min": 122, "max": 126 },
  "modes": ["aeolian", "dorian"],
  "progressions": [
    { "degrees": ["i9", "VImaj7"], "barsPerChord": 2, "weight": 0.8 },
    { "degrees": ["i7", "VII", "iv7", "v7"], "barsPerChord": 2, "weight": 0.6 },
    { "degrees": ["i7", "iv7"], "barsPerChord": 2, "weight": 0.6 },
    { "degrees": ["i9", "III", "VII", "v7"], "barsPerChord": 2, "weight": 0.5 }
  ],
  "voicing": { "style": "piano-spread", "parallel": false, "topNote": [64, 72] },
  "chordRhythms": [
    { "id": "half-bar-pad", "bars": 1, "hits": [[0, 8], [10, 4]] },
    { "id": "push-late", "bars": 1, "hits": [[3, 1], [7, 1], [11, 2], [15, 1]] },
    { "id": "shuffle-offbeat", "bars": 1, "hits": [[2, 2], [5, 1], [10, 2], [13, 1]] },
    { "id": "two-bar-lift", "bars": 2, "hits": [[0, 3], [6, 2], [11, 3], [16, 8], [27, 3]] }
  ],
  "melodyRhythms": [
    { "id": "sparse-four", "bars": 2, "hits": [[3, 2], [11, 2], [19, 2], [26, 3]] },
    { "id": "skip-six", "bars": 2, "hits": [[3, 1], [7, 2], [11, 2], [19, 1], [23, 2], [27, 3]] },
    { "id": "skip-eight", "bars": 2, "hits": [[3, 1], [5, 1], [7, 2], [11, 2], [19, 1], [21, 1], [23, 2], [27, 3]] },
    { "id": "skip-nine", "bars": 2, "hits": [[1, 1], [3, 2], [6, 1], [7, 2], [11, 2], [14, 1], [19, 2], [22, 2], [27, 3]] }
  ],
  "bassPatterns": ["garage-skip", "offbeat", "riff"],
  "melodyModes": ["sparse", "hook"],
  "swing": 0.62,
  "tags": ["gorgon-ish", "garage"]
}
