{
  "schemaVersion": 1,
  "id": "bassline-starter-03",
  "family": "bassline",
  "name": "Dark driving stabs",
  "source": { "kind": "hand-authored", "reference": null, "confidence": "placeholder" },
  "tempo": { "min": 122, "max": 126 },
  "modes": ["aeolian", "phrygian"],
  "progressions": [
    { "degrees": ["i", "VI", "VII"], "barsPerChord": 2, "weight": 1.0 },
    { "degrees": ["i", "iv", "v"], "barsPerChord": 2, "weight": 0.8 },
    { "degrees": ["i", "VI", "III", "VII"], "barsPerChord": 1, "weight": 0.7 },
    { "degrees": ["i7"], "barsPerChord": 4, "weight": 0.6 },
    { "degrees": ["iv", "i"], "barsPerChord": [2, 4], "weight": 0.6 },
    { "degrees": ["i7", "VII", "iv7"], "barsPerChord": [2, 1, 1], "weight": 0.6 }
  ],
  "voicing": { "style": "drop-2", "parallel": false, "topNote": [64, 72] },
  "chordRhythms": [
    { "id": "driving-stabs", "bars": 1, "hits": [[0, 2], [3, 1], [6, 2], [10, 1], [14, 2]] },
    { "id": "roll-stab", "bars": 1, "hits": [[2, 1], [5, 1], [8, 1], [11, 1], [13, 1]] },
    { "id": "low-hold", "bars": 1, "hits": [[0, 6], [10, 2], [13, 2]] },
    { "id": "two-bar-drive", "bars": 2, "hits": [[0, 2], [3, 1], [6, 2], [10, 2], [16, 2], [19, 1], [22, 2], [27, 1], [30, 1]] },
    { "id": "dark-pair", "bars": 1, "hits": [[4, 2], [12, 2]] },
    { "id": "late-skip", "bars": 1, "hits": [[1, 1], [6, 1], [9, 1], [14, 1]] }
  ],
  "melodyRhythms": [
    { "id": "dark-three", "bars": 2, "hits": [[3, 2], [14, 2], [27, 3]] },
    { "id": "dark-five", "bars": 2, "hits": [[3, 1], [6, 2], [14, 1], [19, 2], [27, 2]] },
    { "id": "dark-seven", "bars": 2, "hits": [[2, 1], [3, 1], [6, 1], [11, 2], [19, 1], [22, 2], [27, 2]] },
    { "id": "dark-ten", "bars": 2, "hits": [[1, 1], [3, 1], [5, 1], [7, 1], [11, 1], [14, 1], [19, 1], [21, 1], [23, 1], [27, 2]] }
  ],
  "bassPatterns": ["rolling-offbeat", "garage-skip", "riff"],
  "melodyModes": ["sparse", "riff"],
  "swing": 0.6,
  "tags": ["gorgon-ish", "dark", "driving"]
}
