{
  "schemaVersion": 1,
  "id": "festival-starter-03",
  "family": "festival",
  "name": "Anthemic major pumps",
  "source": { "kind": "hand-authored", "reference": null, "confidence": "placeholder" },
  "tempo": { "min": 124, "max": 126 },
  "modes": ["ionian", "mixolydian"],
  "progressions": [
    { "degrees": ["I", "V", "vi", "IV"], "barsPerChord": 2, "weight": 1.0 },
    { "degrees": ["vi", "IV", "I", "V"], "barsPerChord": 2, "weight": 0.9 },
    { "degrees": ["IV", "V", "vi"], "barsPerChord": [2, 2, 4], "weight": 0.7 },
    { "degrees": ["I", "IV"], "barsPerChord": 4, "weight": 0.6 },
    { "degrees": ["I", "iii", "IV", "V"], "barsPerChord": 2, "weight": 0.7 },
    { "degrees": ["IV", "I", "V", "vi"], "barsPerChord": 1, "weight": 0.8 }
  ],
  "voicing": { "style": "piano-spread", "parallel": false, "topNote": [69, 77] },
  "chordRhythms": [
    { "id": "anthem-pump", "bars": 1, "hits": [[0, 3], [4, 3], [8, 3], [12, 3]] },
    { "id": "long-quarters", "bars": 1, "hits": [[0, 4], [4, 4], [8, 4], [12, 4]] },
    { "id": "pump-offbeat", "bars": 1, "hits": [[2, 3], [6, 3], [10, 3], [14, 2]] },
    { "id": "hit-and-hold", "bars": 2, "hits": [[0, 2], [4, 2], [8, 2], [12, 2], [16, 14]] },
    { "id": "big-lift", "bars": 2, "hits": [[0, 6], [8, 6], [16, 6], [24, 4], [28, 4]] },
    { "id": "pump-then-pad", "bars": 2, "hits": [[0, 3], [4, 3], [8, 3], [12, 3], [16, 16]] }
  ],
  "melodyRhythms": [
    { "id": "chant-three", "bars": 2, "hits": [[0, 6], [10, 6], [20, 8]] },
    { "id": "chant-five", "bars": 2, "hits": [[2, 3], [6, 2], [12, 3], [18, 3], [26, 4]] },
    { "id": "chant-seven", "bars": 2, "hits": [[0, 2], [4, 2], [8, 2], [12, 3], [18, 2], [22, 2], [26, 4]] },
    { "id": "chant-ten", "bars": 2, "hits": [[0, 2], [4, 1], [6, 1], [8, 2], [12, 2], [16, 2], [20, 1], [22, 1], [24, 2], [28, 3]] }
  ],
  "bassPatterns": ["rolling-offbeat", "octave-bounce", "offbeat"],
  "melodyModes": ["hook", "riff"],
  "swing": 0.52,
  "tags": ["solardo-ish", "anthem", "bright"]
}
