{
  "schemaVersion": 1,
  "id": "soulful-starter-02",
  "family": "soulful",
  "name": "Smooth turnarounds",
  "source": { "kind": "hand-authored", "reference": null, "confidence": "placeholder" },
  "tempo": { "min": 122, "max": 125 },
  "modes": ["aeolian", "dorian"],
  "progressions": [
    { "degrees": ["i9", "iv9", "VII", "VImaj7"], "barsPerChord": 2, "weight": 0.8 },
    { "degrees": ["IV9", "i9"], "barsPerChord": 2, "weight": 0.6 },
    { "degrees": ["i9", "VImaj9"], "barsPerChord": 2, "weight": 0.6 },
    { "degrees": ["IIImaj7", "VImaj7", "VII", "i9"], "barsPerChord": 2, "weight": 0.5 }
  ],
  "voicing": { "style": "close", "parallel": false, "topNote": [65, 74] },
  "chordRhythms": [
    { "id": "syncopated-comp", "bars": 1, "hits": [[0, 4], [6, 2], [8, 4], [14, 2]] },
    { "id": "offbeat-warm", "bars": 1, "hits": [[2, 4], [8, 2], [10, 4]] },
    { "id": "held-then-stab", "bars": 2, "hits": [[0, 12], [14, 2], [16, 10], [28, 2], [30, 2]] },
    { "id": "ghost-comp", "bars": 1, "hits": [[0, 2], [3, 2], [6, 2], [10, 4], [14, 2]] }
  ],
  "melodyRhythms": [
    { "id": "hook-four", "bars": 2, "hits": [[3, 3], [8, 4], [19, 3], [24, 6]] },
    { "id": "hook-six", "bars": 2, "hits": [[0, 3], [6, 2], [10, 2], [19, 2], [22, 2], [27, 3]] },
    { "id": "hook-eight", "bars": 2, "hits": [[2, 1], [3, 2], [6, 2], [10, 2], [14, 1], [19, 2], [22, 2], [27, 3]] },
    { "id": "hook-nine", "bars": 2, "hits": [[1, 1], [3, 2], [6, 1], [7, 2], [10, 2], [14, 2], [18, 2], [22, 2], [27, 3]] }
  ],
  "bassPatterns": ["pedal", "sustained", "octave-bounce"],
  "melodyModes": ["hook", "sparse"],
  "swing": 0.56,
  "tags": ["sonny-ish", "smooth"]
}
