{
  "schemaVersion": 1,
  "id": "ny-groove-starter-02",
  "family": "ny-groove",
  "name": "Raw groove changes",
  "source": { "kind": "hand-authored", "reference": null, "confidence": "placeholder" },
  "tempo": { "min": 122, "max": 126 },
  "modes": ["aeolian", "dorian"],
  "progressions": [
    { "degrees": ["i9", "iv9"], "barsPerChord": 2, "weight": 0.8 },
    { "degrees": ["i11", "iv9"], "barsPerChord": 4, "weight": 0.7 },
    { "degrees": ["i7", "VII", "VI", "VII"], "barsPerChord": 2, "weight": 0.6 },
    { "degrees": ["i7", "III", "iv7", "v7"], "barsPerChord": 2, "weight": 0.5 }
  ],
  "voicing": { "style": "organ-stab", "parallel": false, "topNote": [66, 74] },
  "chordRhythms": [
    { "id": "hold-and-chop", "bars": 1, "hits": [[0, 4], [6, 1], [7, 1], [10, 1], [14, 1]] },
    { "id": "vamp-offbeat", "bars": 1, "hits": [[2, 1], [5, 1], [8, 1], [11, 1], [14, 1]] },
    { "id": "stab-gap", "bars": 2, "hits": [[3, 1], [6, 1], [10, 1], [14, 1], [19, 1], [27, 1]] },
    { "id": "rolling-chop", "bars": 1, "hits": [[1, 1], [3, 1], [6, 1], [9, 1], [11, 1], [14, 1]] }
  ],
  "melodyRhythms": [
    { "id": "quin-four", "bars": 2, "hits": [[3, 1], [6, 2], [19, 1], [27, 3]] },
    { "id": "quin-six", "bars": 2, "hits": [[3, 1], [6, 1], [10, 2], [19, 1], [22, 1], [27, 3]] },
    { "id": "quin-eight", "bars": 2, "hits": [[3, 1], [6, 1], [7, 1], [10, 2], [19, 1], [22, 1], [23, 1], [27, 3]] },
    { "id": "quin-nine", "bars": 2, "hits": [[2, 1], [3, 1], [6, 1], [7, 1], [11, 1], [18, 1], [19, 1], [22, 2], [27, 3]] }
  ],
  "bassPatterns": ["rolling-offbeat", "garage-skip", "call-response"],
  "melodyModes": ["sparse", "riff"],
  "swing": 0.58,
  "tags": ["quin-ish", "groove"]
}
