{
  "schemaVersion": 1,
  "id": "ny-groove-starter-01",
  "family": "ny-groove",
  "name": "Chopped stab vamp",
  "source": { "kind": "hand-authored", "reference": null, "confidence": "placeholder" },
  "tempo": { "min": 122, "max": 126 },
  "modes": ["aeolian", "dorian"],
  "progressions": [
    { "degrees": ["i7", "iv7"], "barsPerChord": 2, "weight": 1.0 },
    { "degrees": ["i11"], "barsPerChord": 8, "weight": 0.8 },
    { "degrees": ["i7", "VII"], "barsPerChord": 2, "weight": 0.6 },
    { "degrees": ["i7", "iv7", "i7", "v7"], "barsPerChord": 1, "weight": 0.5 }
  ],
  "voicing": { "style": "organ-stab", "parallel": true, "topNote": [66, 74] },
  "chordRhythms": [
    { "id": "chop-a", "bars": 1, "hits": [[0, 1], [3, 1], [6, 1], [10, 1], [13, 1]] },
    { "id": "chop-b", "bars": 1, "hits": [[2, 1], [3, 1], [7, 1], [10, 1], [11, 1], [15, 1]] },
    { "id": "raw-stab", "bars": 1, "hits": [[0, 2], [3, 1], [6, 2], [10, 2], [14, 1]] },
    { "id": "two-bar-chop", "bars": 2, "hits": [[0, 1], [3, 1], [6, 1], [10, 1], [16, 1], [19, 1], [22, 2], [27, 1], [30, 1]] }
  ],
  "melodyRhythms": [
    { "id": "quin-three", "bars": 2, "hits": [[3, 2], [14, 3], [22, 2]] },
    { "id": "quin-five", "bars": 2, "hits": [[2, 1], [7, 2], [11, 1], [18, 2], [27, 2]] },
    { "id": "quin-seven", "bars": 2, "hits": [[2, 1], [3, 1], [7, 2], [11, 1], [18, 1], [22, 2], [27, 2]] },
    { "id": "quin-ten", "bars": 2, "hits": [[1, 1], [3, 1], [6, 1], [7, 1], [10, 1], [11, 1], [18, 1], [19, 1], [22, 1], [27, 3]] }
  ],
  "bassPatterns": ["octave-bounce", "offbeat"],
  "melodyModes": ["sparse", "riff"],
  "swing": 0.56,
  "tags": ["quin-ish", "raw"]
}
