{
  "schemaVersion": 1,
  "id": "festival-starter-02",
  "family": "festival",
  "name": "Rising stabs",
  "source": { "kind": "hand-authored", "reference": null, "confidence": "placeholder" },
  "tempo": { "min": 126, "max": 130 },
  "modes": ["aeolian", "dorian"],
  "progressions": [
    { "degrees": ["i9", "VII"], "barsPerChord": 2, "weight": 0.8 },
    { "degrees": ["VImaj7", "VII", "i7"], "barsPerChord": [2, 2, 4], "weight": 0.6 },
    { "degrees": ["i7", "VImaj7"], "barsPerChord": 2, "weight": 0.6 },
    { "degrees": ["i11", "VII"], "barsPerChord": 4, "weight": 0.5 }
  ],
  "voicing": { "style": "drop-2", "parallel": false, "topNote": [69, 77] },
  "chordRhythms": [
    { "id": "rising-stabs", "bars": 2, "hits": [[2, 1], [6, 1], [10, 1], [14, 1], [18, 1], [22, 1], [26, 1], [27, 1], [30, 1], [31, 1]] },
    { "id": "stab-and-pad", "bars": 1, "hits": [[0, 6], [10, 1], [12, 1], [14, 1]] },
    { "id": "build-pickup", "bars": 2, "hits": [[0, 16], [18, 1], [22, 1], [26, 1], [28, 1], [30, 1]] },
    { "id": "sixteenth-run", "bars": 1, "hits": [[1, 1], [3, 1], [5, 1], [7, 1], [9, 1], [11, 1], [13, 1], [15, 1]] }
  ],
  "melodyRhythms": [
    { "id": "anthem-four", "bars": 2, "hits": [[2, 2], [10, 4], [18, 2], [26, 4]] },
    { "id": "anthem-six", "bars": 2, "hits": [[2, 2], [6, 2], [10, 2], [18, 2], [22, 2], [26, 4]] },
    { "id": "anthem-eight", "bars": 2, "hits": [[2, 2], [6, 2], [10, 2], [14, 1], [18, 2], [22, 2], [26, 2], [30, 1]] },
    { "id": "anthem-nine", "bars": 2, "hits": [[1, 1], [2, 1], [6, 2], [10, 2], [14, 1], [18, 2], [22, 2], [26, 2], [30, 1]] }
  ],
  "bassPatterns": ["rolling-offbeat", "offbeat"],
  "melodyModes": ["hook", "riff"],
  "swing": 0.54,
  "tags": ["solardo-ish", "build"]
}
